,utteranceID,Group_x,Start_x,End_x,CPS_CONST_SharesU_Situation,CPS_CONST_SharesU_CorrectSolutions,CPS_CONST_SharesU_IncorrectSolutions,CPS_CONST_EstablishesCG_Confirms,CPS_CONST_EstablishesCG_Interrupts,CPS_NEG_Responds_Reasons,CPS_NEG_Responds_QuestionsOthers,CPS_NEG_Responds_Responds,CPS_NEG_MonitorsE_Results,CPS_NEG_MonitorsE_Strategizes,CPS_NEG_MonitorsE_Save,CPS_NEG_MonitorsE_GivingUp,CPS_MAINTAIN_Initiative_Suggestions,CPS_MAINTAIN_Initiative_Compliments,CPS_MAINTAIN_Initiative_Criticizes,CPS_MAINTAIN_FulfillsR_Support,CPS_MAINTAIN_FulfillsR_Apologizes,CPS_MAINTAIN_FulfillsR_InitiatesOffTopic,CPS_MAINTAIN_FulfillsR_JoinsOffTopic,Utterance,Start_y,End_y,Group_y,Participant,Transcript
0,Group_01_0,Group_01,3.45,7.14,0,0,0,0,0,0,0,0,0,0,0,0,0,0,0,0,0,0,0,0,3.45,7.14,1,4,I just need to calibrate my cameras real quick
1,Group_01_1,Group_01,9.87,12.45,0,0,0,0,0,0,0,0,0,0,0,0,0,0,0,0,0,0,0,1,9.87,12.45,1,4,Alright so
2,Group_01_2,Group_01,12.63,15.75,0,0,0,0,0,0,0,0,0,0,0,0,0,0,0,0,0,0,0,2,12.63,15.75,1,4,The task that you are doing today is called the weights task
3,Group_01_3,Group_01,16.2,21.36,0,0,0,0,0,0,0,0,0,0,0,0,0,0,0,0,0,0,0,3,16.2,21.36,1,4,In the first part you are going to work together to determine the weight of 5 cubes
4,Group_01_4,Group_01,22.17,24.27,0,0,0,0,0,0,0,0,0,0,0,0,0,0,0,0,0,0,0,4,22.17,24.27,1,4,Um and then
5,Group_01_5,Group_01,24.42,27.72,0,0,0,0,0,0,0,0,0,0,0,0,0,0,0,0,0,0,0,5,24.42,27.72,1,4,And we will tell you that this red cube on top is ten grams
6,Group_01_6,Group_01,29.08,29.83,0,0,0,0,0,0,0,0,0,0,0,0,0,0,0,0,0,0,0,6,29.08,29.83,1,1,Ok yeah  
7,Group_01_7,Group_01,29.84,31.32,0,0,0,0,0,0,0,0,0,0,0,0,0,0,0,0,0,0,0,7,29.84,31.32,1,4,So uh
8,Group_01_8,Group_01,31.44,34.56,0,0,0,0,0,0,0,0,0,0,0,0,0,0,0,0,0,0,0,8,31.44,34.56,1,4,You don't need to touch the slider on the scale don't worry about that part at all
9,Group_01_9,Group_01,35.01,36.99,0,0,0,0,0,0,0,0,0,0,0,0,0,0,0,0,0,0,0,9,35.01,36.99,1,4,Oh
10,Group_01_10,Group_01,37.83,47.82,0,0,0,0,0,0,0,0,0,0,0,0,0,0,0,0,0,0,0,10,37.83,47.82,1,4,So you have to place sorry please place the scales place the cubes on this worksheet where you prove that they weigh again yes
11,Group_01_11,Group_01,48.27,52.25,0,0,0,0,0,0,0,0,0,0,0,0,0,0,0,0,0,0,0,11,48.27,52.25,1,4,And uh as you are filling it out if you guys can fill out the survey you will be group one
12,Group_01_12,Group_01,52.58,54.84,1,0,0,0,0,0,0,0,0,0,0,0,0,0,0,0,0,0,0,12,52.58,54.84,1,1,Oh and we don't touch the scale yet
13,Group_01_13,Group_01,54.93,58.29,0,0,0,0,0,0,0,0,0,0,0,0,0,0,0,0,0,0,0,13,54.93,58.29,1,4,Um you can touch the scale just like there's a slider
14,Group_01_14,Group_01,58.33,58.84,0,0,0,0,0,0,0,0,0,0,0,0,0,0,0,0,0,0,0,14,58.33,58.84,1,3,It's right there
15,Group_01_15,Group_01,59.22,60.92,0,0,0,0,0,0,0,0,0,0,0,0,0,0,0,0,0,0,0,15,59.22,60.92,1,4,But like you dont need to do anything with the slider
16,Group_01_16,Group_01,60.66,62.49,0,0,0,1,0,0,0,0,0,0,0,0,0,0,0,0,0,0,0,16,60.66,62.49,1,1,Ok so you want us to
17,Group_01_17,Group_01,62.58,65.18,0,0,0,1,0,0,0,0,0,0,0,0,0,0,0,0,0,0,0,17,62.58,65.18,1,1,Use the scale to determine the weights ok cool
18,Group_01_18,Group_01,64.91,69.66,0,0,0,0,0,0,0,0,0,0,0,0,0,0,0,0,0,0,0,18,64.91,69.66,1,4,Yes um and if you guys can fill out that survey like as you go because you'll be submitting answers on there
19,Group_01_19,Group_01,69.81,71.51,0,0,0,1,0,0,0,0,0,0,0,0,0,0,0,0,0,0,0,19,69.81,71.51,1,1,Where's the survey oh ok
20,Group_01_20,Group_01,70.51,70.01,0,0,0,0,0,0,0,0,0,0,0,0,0,0,0,0,0,0,0,20,70.51,71.01,1,3,Um it's turned off
21,Group_01_21,Group_01,72.25,73.53,0,0,0,0,0,0,0,0,0,0,0,0,0,0,0,0,0,0,0,21,72.25,73.53,1,4,Oh
22,Group_01_22,Group_01,75.81,77.17,0,0,0,0,0,0,0,0,0,0,0,0,0,0,0,0,0,0,0,22,75.81,77.17,1,4,And you guys will be group one
23,Group_01_23,Group_01,77.51,77.75,0,0,0,0,0,0,0,0,0,0,0,0,0,0,0,0,0,0,0,23,77.51,77.75,1,2,Ok
24,Group_01_24,Group_01,78.08,80.58,0,0,0,0,0,0,0,0,0,0,0,0,0,0,0,0,0,0,0,24,78.08,80.58,1,1,Ok well it would be nine minus ten
25,Group_01_25,Group_01,78.58,78.08,0,0,0,0,0,0,0,0,0,0,0,0,0,0,0,0,0,0,0,25,78.58,79.08,1,3,One
26,Group_01_26,Group_01,80.58,84.3,0,0,0,0,0,0,0,0,0,0,0,0,0,0,0,0,0,0,0,26,80.58,84.3,1,2,That's ten so then
27,Group_01_27,Group_01,86.07,87.41,0,1,0,0,0,0,0,0,0,0,0,0,0,0,0,0,0,0,0,27,86.07,87.41,1,1,Just like put it on
28,Group_01_28,Group_01,87.48,89.04,0,0,0,0,0,0,0,0,0,0,0,0,0,0,0,0,0,0,0,28,87.48,89.04,1,2,Does the slider move
29,Group_01_29,Group_01,90.12,92.13,0,0,0,0,0,0,0,0,1,0,0,0,0,0,0,0,0,0,0,29,90.12,92.13,1,1,Hold on lets just uh
30,Group_01_30,Group_01,95.19,97.17,0,0,0,0,0,0,0,0,1,0,0,0,0,0,0,0,0,0,0,30,95.19,97.17,1,3,It seems pretty balanced
31,Group_01_31,Group_01,97.56,102.03,0,0,0,0,0,0,0,0,1,0,0,0,0,0,0,0,0,0,0,31,97.56,102.03,1,1,Yeah ok so now we know that this is also ten
32,Group_01_32,Group_01,102.39,105.87,0,0,0,0,0,0,0,0,0,0,0,0,0,0,0,0,0,0,0,32,102.39,105.87,1,1,Um ok so now
33,Group_01_33,Group_01,104.08,104.58,0,0,0,0,0,0,0,0,0,0,0,0,0,0,0,0,0,0,0,33,104.08,104.58,1,2,Ok
34,Group_01_34,Group_01,106.23,110.01,0,1,0,0,0,0,0,0,0,0,0,0,0,0,0,0,0,0,0,34,106.23,110.01,1,1,What would we maybe put that one on there too
35,Group_01_35,Group_01,108.63,109.33,0,0,0,0,0,0,0,0,0,0,0,0,0,0,0,0,0,0,0,35,108.63,109.33,1,2,Cool
36,Group_01_36,Group_01,110.16,114.24,0,1,0,0,0,0,0,0,1,0,0,0,0,0,0,0,0,0,0,36,110.16,114.24,1,1,And then see if there's thats twenty which is not
37,Group_01_37,Group_01,112.16,112.92,0,0,0,0,0,0,0,0,1,0,0,0,0,0,0,0,0,0,0,37,112.16,112.92,1,2,It's more
38,Group_01_38,Group_01,114.87,120.33,0,1,0,0,0,0,0,0,0,0,0,0,0,0,0,0,0,0,0,38,114.87,120.33,1,1,Lets try this one oh gee louise this one
39,Group_01_39,Group_01,117.41,118.25,0,0,0,0,0,0,0,0,0,0,0,0,0,0,0,0,0,0,0,39,117.41,118.25,1,3,No  
40,Group_01_40,Group_01,121.2,125.01,0,0,0,0,0,0,0,0,0,0,0,0,0,0,0,0,1,0,0,40,121.2,125.01,1,1,Ok lets just oops sorry
41,Group_01_41,Group_01,127.35,132.0,0,0,0,0,0,0,0,0,1,0,0,0,0,0,0,0,0,0,0,41,127.35,132.0,1,2,Ok so this one is probably twenty ten ten twenty
42,Group_01_42,Group_01,128.83,130.08,0,0,0,0,1,0,0,0,1,0,0,0,0,0,0,0,0,0,0,42,128.83,130.08,1,3,Yeah seems about twenty
43,Group_01_43,Group_01,128.41,130.75,0,0,0,0,1,0,0,0,1,0,0,0,0,0,0,0,0,0,0,43,128.41,130.75,1,1,Ok so ten ten twenty
44,Group_01_44,Group_01,132.27,139.65,0,1,0,0,0,0,0,0,0,0,0,0,0,0,0,0,0,0,0,44,132.27,139.65,1,1,Ok so now lets start at thirty alright put one of those on there
45,Group_01_45,Group_01,135.33,135.91,0,0,0,0,0,0,0,0,0,0,0,0,0,0,0,0,0,0,0,45,135.33,135.91,1,3,Yes  
46,Group_01_46,Group_01,135.73,136.41,0,0,0,0,0,0,0,0,0,0,0,0,0,0,0,0,0,0,0,46,135.73,136.41,1,2,Yeah thirty
47,Group_01_47,Group_01,140.73,145.89,0,0,0,0,0,0,0,0,1,0,0,0,0,0,0,0,0,0,0,47,140.73,145.89,1,1,Ooh its looking like thirty
48,Group_01_48,Group_01,142.91,144.92,0,0,0,0,0,0,0,0,1,0,0,0,0,0,0,0,0,0,0,48,142.91,144.92,1,2,Probably thirty at this point
49,Group_01_49,Group_01,148.86,159.42,0,1,0,0,1,0,0,0,1,0,0,0,0,0,0,0,0,0,0,49,148.86,159.42,1,1,Ok so we got ok yeah this one is really heavy so lets do the a this and a ten
50,Group_01_50,Group_01,149.25,154.25,0,0,0,0,1,0,0,0,1,0,0,0,0,0,0,0,0,0,0,50,149.25,154.25,1,2,Yeah ten ten twenty thirty
51,Group_01_51,Group_01,153.21,155.25,0,0,0,0,1,0,0,0,1,0,0,0,0,0,0,0,0,0,0,51,153.21,155.25,1,3,Twenty thirty forty
52,Group_01_52,Group_01,159.6,163.86,0,0,0,1,0,0,0,0,0,0,0,0,0,0,0,0,0,0,0,52,159.6,163.86,1,3,So fourty pounds
53,Group_01_53,Group_01,162.91,163.86,0,0,0,0,0,0,0,1,0,0,0,0,0,0,0,0,0,0,0,53,162.91,163.86,1,1,Yeah
54,Group_01_54,Group_01,164.37,167.91,0,1,0,0,0,0,0,0,0,0,0,0,0,0,0,0,0,0,0,54,164.37,167.91,1,3,Fifty pounds or pounds grams
55,Group_01_55,Group_01,169.31,171.99,0,0,0,0,0,0,0,0,0,0,0,0,0,0,0,0,0,0,0,55,169.31,171.99,1,1,Interesting so that's ten twenty
56,Group_01_56,Group_01,172.56,183.58,0,0,0,1,0,0,0,0,1,0,0,0,0,0,0,0,0,0,0,56,172.56,183.58,1,1,So we said this ones thirty I still feel like that's heavier and this one is twenty
57,Group_01_57,Group_01,174.54,185.08,0,0,0,0,0,0,0,1,1,0,0,0,0,0,0,0,0,0,0,57,174.54,185.08,1,2,Yeah yeah the blue dark blue one is thirty that's the larger one it's slightly heavier yeah
58,Group_01_58,Group_01,185.33,187.83,0,1,0,0,0,0,0,0,0,0,0,0,0,0,0,0,0,0,0,58,185.33,187.83,1,3,We can replace one of these with the twenty to get
59,Group_01_59,Group_01,188.1,189.5,0,1,0,0,0,0,0,0,0,0,0,0,0,0,0,0,0,0,0,59,188.1,189.5,1,3,Sixty here
60,Group_01_60,Group_01,189.91,196.44,0,1,0,0,0,0,0,0,0,0,0,0,0,0,0,0,0,0,0,60,189.91,196.44,1,1,Ok and then put that on that one
61,Group_01_61,Group_01,198.15,202.14,0,0,0,1,0,0,0,0,0,0,0,0,0,0,0,0,0,0,0,61,198.15,202.14,1,2,How much is the dark blue small one ten
62,Group_01_62,Group_01,200.31,201.37,0,0,0,0,0,0,0,1,0,0,0,0,0,0,0,0,0,0,0,62,200.31,201.37,1,1,Ten they're both
63,Group_01_63,Group_01,203.49,204.34,0,0,0,0,0,0,0,1,0,0,0,0,0,0,0,0,0,0,0,63,203.49,204.34,1,1,Assuming that this was
64,Group_01_64,Group_01,204.58,206.37,0,0,0,0,0,0,0,0,0,0,0,0,0,0,0,0,0,0,0,64,204.58,206.37,1,2,Oh gosh I think I got them mixed up
65,Group_01_65,Group_01,207.06,210.87,0,0,0,0,0,0,0,0,1,0,0,0,0,0,0,0,0,0,0,65,207.06,210.87,1,1,Yeah Im thinking that it's ten ten twenty thirty
66,Group_01_66,Group_01,211.29,213.93,0,0,0,1,0,0,0,0,1,0,0,0,0,0,0,0,0,0,0,66,211.29,213.93,1,1,So what have we done weve done forty
67,Group_01_67,Group_01,214.47,216.45,0,0,0,0,0,0,0,0,0,0,0,0,0,0,0,0,0,0,0,67,214.47,216.45,1,1,Um
68,Group_01_68,Group_01,216.63,219.06,0,0,0,0,0,0,0,0,1,0,0,0,0,0,0,0,0,0,0,68,216.63,219.06,1,1,And then we did fifty
69,Group_01_69,Group_01,216.16,217.66,0,0,0,0,0,0,0,0,1,0,0,0,0,0,0,0,0,0,0,69,216.16,217.66,1,2,It's just like slightly 
70,Group_01_70,Group_01,219.33,221.49,0,0,0,0,0,0,0,0,1,0,0,0,0,0,0,0,0,0,0,70,219.33,221.49,1,1,And then we did sixty
71,Group_01_71,Group_01,228.06,231.51,0,0,0,0,0,0,0,0,1,0,0,0,0,0,0,0,0,0,0,71,228.06,231.51,1,1,And now it stopped being too heavy
72,Group_01_72,Group_01,231.54,233.52,0,0,0,0,0,0,0,0,0,0,0,0,0,0,0,0,0,0,0,72,231.54,233.52,1,1,So this is supposedly
73,Group_01_73,Group_01,234.27,239.82,0,0,0,1,0,0,0,0,1,0,0,0,0,0,0,0,0,0,0,73,234.27,239.82,1,1,Thirty fourty fifty correct and it's still heavier than this thing
74,Group_01_74,Group_01,235.83,237.58,0,0,0,0,0,0,0,1,0,0,0,0,0,0,0,0,0,0,0,74,235.83,237.58,1,2,Fifty yeah
75,Group_01_75,Group_01,240.84,242.82,0,1,0,0,0,0,0,0,0,0,0,0,0,0,0,0,0,0,0,75,240.84,242.82,1,1,So have we done forty
76,Group_01_76,Group_01,251.88,258.72,0,0,0,1,0,0,0,0,1,0,0,0,0,0,0,0,0,0,0,76,251.88,258.72,1,1,So thirty this is also forty right so this if forty yeah
77,Group_01_77,Group_01,254.63,255.31,0,0,0,1,0,0,0,0,1,0,0,0,0,0,0,0,0,0,0,77,254.63,255.31,1,2,Ok so that one's twenty right
78,Group_01_78,Group_01,256.84,257.01,0,0,0,0,0,0,0,1,0,0,0,0,0,0,0,0,0,0,0,78,256.84,257.01,1,3,Yes
79,Group_01_79,Group_01,260.01,263.82,0,0,0,0,0,0,0,0,1,0,0,0,0,0,0,0,0,0,0,79,260.01,263.82,1,1,This is fifty it's not 
80,Group_01_80,Group_01,264.93,267.36,0,0,0,0,0,0,0,0,1,0,0,0,0,0,0,0,0,0,0,80,264.93,267.36,1,1,Yo that's close enough ok so
81,Group_01_81,Group_01,268.08,272.58,0,0,0,0,0,0,0,0,1,0,0,0,0,0,0,0,0,0,0,81,268.08,272.58,1,3,Yeah fifty so we say yellow is fifty
82,Group_01_82,Group_01,267.57,269.42,0,0,0,0,0,0,0,0,0,0,0,0,0,0,0,0,0,0,0,82,267.57,269.42,1,1,Fifty boom
83,Group_01_83,Group_01,274.26,280.32,0,0,0,0,0,0,0,0,1,0,0,0,1,0,0,0,0,0,0,83,274.26,280.32,1,3,And green is twenty ok so which one is blue and which one is purple
84,Group_01_84,Group_01,275.75,279.11,0,0,0,0,0,0,0,1,0,0,0,0,0,0,0,0,0,0,0,84,275.75,279.11,1,2,Yeah
85,Group_01_85,Group_01,275.83,277.75,0,0,0,0,0,0,0,0,0,0,0,0,0,1,0,0,0,0,0,85,275.83,277.75,1,1,I think that's I think that's good
86,Group_01_86,Group_01,281.25,283.48,0,0,0,0,0,0,0,1,0,0,0,0,0,0,0,0,0,0,0,86,281.25,283.48,1,2,I think this one is purple and this one is blue
87,Group_01_87,Group_01,282.25,286.26,0,0,0,1,0,0,0,0,1,0,0,0,0,0,0,0,0,0,0,87,282.25,286.26,1,3,Ok so blue is ten and purple is 
88,Group_01_88,Group_01,286.56,287.08,0,0,0,1,0,0,0,0,1,0,0,0,0,0,0,0,0,0,0,88,286.56,287.08,1,3,Thirty
89,Group_01_89,Group_01,288.92,292.47,0,0,0,0,0,0,0,1,0,0,0,0,0,0,0,0,0,0,0,89,288.92,292.47,1,1,Yes verify real quick but I think it is
90,Group_01_90,Group_01,288.91,289.41,0,0,0,0,0,0,0,1,1,0,0,0,0,0,0,0,0,0,0,90,288.91,289.41,1,2,Yes thirty
91,Group_01_91,Group_01,295.32,304.62,0,0,0,0,0,0,0,0,0,0,0,0,0,0,0,0,0,0,0,91,295.32,304.62,1,1,Yeah we got them yeah
92,Group_01_92,Group_01,296.48,296.79,0,0,0,0,0,0,0,0,0,0,0,0,0,0,0,0,0,0,0,92,296.48,296.79,1,2,Yeah
93,Group_01_93,Group_01,295.66,302.75,0,0,0,0,0,0,0,0,0,0,0,0,1,0,0,0,0,0,0,93,295.66,302.75,1,3,Yes do you want to check real quick
94,Group_01_94,Group_01,304.68,305.58,0,0,0,0,0,0,0,1,0,0,0,0,0,1,0,0,0,0,0,94,304.68,305.58,1,1,That looks good to me
95,Group_01_95,Group_01,304.48,306.03,0,0,0,0,0,0,0,1,0,0,0,0,0,1,0,0,0,0,0,95,304.48,306.03,1,2,Seems about right to me
96,Group_01_96,Group_01,305.91,307.2,0,0,0,0,0,0,0,0,0,0,0,0,0,0,0,0,0,0,0,96,305.91,307.2,1,3,Ok
97,Group_01_97,Group_01,308.28,312.3,0,0,0,0,0,0,0,0,0,0,0,0,0,1,0,0,0,0,0,97,308.28,312.3,1,1,Uh blue yeah so you said purple sweet
98,Group_01_98,Group_01,312.93,315.42,0,0,0,0,0,0,0,0,0,0,0,0,0,0,0,0,0,0,0,98,312.93,315.42,1,2,Purple is thirty red is twenty yellow is fifty
99,Group_01_99,Group_01,313.82,314.42,0,0,0,0,1,0,0,0,0,0,0,0,0,1,0,0,0,0,0,99,313.82,314.42,1,1,You're right
100,Group_01_100,Group_01,315.66,315.91,0,0,0,0,0,0,0,0,0,0,0,0,0,1,0,0,0,0,0,100,315.66,315.91,1,3,Cool
101,Group_01_101,Group_01,318.72,321.81,0,0,0,0,0,0,0,0,0,0,0,0,0,1,0,0,0,0,0,101,318.72,321.81,1,1,Ok we have finished and we were correct
102,Group_01_102,Group_01,321.84,323.97,0,0,0,0,0,0,0,0,0,0,0,0,0,0,0,0,0,0,0,102,321.84,323.97,1,4,Ok awesome um
103,Group_01_103,Group_01,324.12,339.63,0,0,0,0,0,0,0,0,0,0,0,0,0,0,0,0,0,0,0,103,324.12,339.63,1,4,You are now going to determine the weight of this block without the scale you will have two attempts to get the weight correctly
104,Group_01_104,Group_01,331.17,331.83,0,0,0,0,0,0,0,0,0,0,0,0,0,0,0,0,0,0,0,104,331.17,331.83,1,3,Oh
105,Group_01_105,Group_01,334.38,336.33,0,1,0,0,0,0,0,0,0,0,0,0,0,0,0,0,0,0,0,105,334.38,336.33,1,1,Ok definitely minimum fifty
106,Group_01_106,Group_01,337.08,337.92,0,0,0,0,0,0,0,0,0,0,0,0,0,0,0,0,0,0,0,106,337.08,337.92,1,2,Minimum fifty
107,Group_01_107,Group_01,339.87,341.85,0,0,0,0,0,0,0,0,0,0,0,0,0,0,0,0,0,0,0,107,339.87,341.85,1,4,And you can now continue
108,Group_01_108,Group_01,342.06,347.07,0,1,0,0,0,0,0,0,0,0,0,0,0,0,0,0,0,0,0,108,342.06,347.07,1,1,Yeah cause if you feel the yellow one oh yeah so yeah
109,Group_01_109,Group_01,344.01,347.07,0,0,1,0,1,0,0,0,0,0,0,0,0,0,0,0,0,0,0,109,344.01,347.07,1,3,Do we get a glass of water
110,Group_01_110,Group_01,350.73,351.67,0,0,0,0,0,0,0,0,1,0,0,0,0,0,0,0,0,0,0,110,350.73,351.67,1,2,Definitely heavier
111,Group_01_111,Group_01,351.31,351.75,0,0,0,0,0,0,0,1,0,0,0,0,0,0,0,0,0,0,0,111,351.31,351.75,1,1,Yeah
112,Group_01_112,Group_01,351.65,352.71,0,0,0,0,0,0,0,1,0,0,0,0,0,0,0,0,0,0,0,112,351.65,352.71,1,3,Yeah
113,Group_01_113,Group_01,354.36,359.76,0,0,0,0,0,0,0,0,0,0,0,0,0,0,0,0,0,0,0,113,354.36,359.76,1,1,Ok so we got this ok
114,Group_01_114,Group_01,361.23,365.07,0,0,0,0,0,0,0,0,1,0,0,0,0,0,0,0,0,0,0,114,361.23,365.07,1,1,Ooh that seems pretty good pretty close to me
115,Group_01_115,Group_01,365.49,367.98,0,0,0,1,0,0,0,0,0,0,0,0,0,0,0,0,0,0,0,115,365.49,367.98,1,2,How much was purple thirty
116,Group_01_116,Group_01,368.7,369.42,0,0,0,0,0,0,0,0,0,0,0,0,0,0,0,0,0,0,0,116,368.7,369.42,1,2,Purple was thirty
117,Group_01_117,Group_01,369.91,370.68,0,0,0,0,0,0,0,1,0,0,0,0,0,0,0,0,0,0,0,117,369.91,370.68,1,3,Yeah
118,Group_01_118,Group_01,370.86,372.84,0,0,0,0,0,0,0,0,0,0,0,0,0,0,0,0,0,0,0,118,370.86,372.84,1,2,And yellow was fifty
119,Group_01_119,Group_01,373.89,380.58,0,1,0,0,0,0,0,0,0,0,0,0,0,0,0,1,0,0,0,119,373.89,380.58,1,1,Yeah try picking these two up and you can close your eyes and try to hold it from the
120,Group_01_120,Group_01,374.64,375.25,0,0,0,0,0,0,0,0,0,0,0,0,0,0,0,0,0,0,0,120,374.64,375.25,1,3,Which would put eighty
121,Group_01_121,Group_01,381.48,383.61,0,1,0,0,0,0,0,0,0,0,0,0,0,0,0,1,0,0,0,121,381.48,383.61,1,1,Yeah same point maybe
122,Group_01_122,Group_01,383.7,384.33,1,0,0,0,0,0,0,0,0,0,0,0,0,0,0,0,0,0,0,122,383.7,384.33,1,1,I don't know its hard
123,Group_01_123,Group_01,385.08,388.41,0,0,0,0,0,0,0,0,1,0,0,0,0,0,0,0,0,0,0,123,385.08,388.41,1,3,I almost feel like this one is still heavier
124,Group_01_124,Group_01,394.62,399.66,0,1,0,0,0,0,0,0,1,0,0,0,0,0,0,0,0,0,0,124,394.62,399.66,1,2,This one feels heavier still add like ten to this side I think
125,Group_01_125,Group_01,402.81,406.89,0,0,0,0,0,0,0,0,1,0,0,0,1,0,0,0,0,0,0,125,402.81,406.89,1,2,It still feels heavier but it could just be
126,Group_01_126,Group_01,407.58,410.37,0,0,0,0,0,0,0,0,1,0,0,0,0,0,0,0,0,0,0,126,407.58,410.37,1,3,It is definitely denser which could be skewing
127,Group_01_127,Group_01,410.52,412.5,0,0,0,0,0,0,0,0,0,0,0,0,0,0,0,0,0,0,0,127,410.52,412.5,1,3,Our perception of it
128,Group_01_128,Group_01,413.43,414.58,0,0,0,0,0,0,0,0,0,0,0,0,0,0,0,0,0,0,0,128,413.43,414.58,1,2,So right now that's ninety grams
129,Group_01_129,Group_01,414.91,415.83,0,0,0,0,0,0,0,0,0,0,0,0,0,0,0,0,0,0,0,129,414.91,415.83,1,1,Oh jeez yeah
130,Group_01_130,Group_01,416.76,420.03,0,0,0,0,0,0,0,0,0,0,0,0,0,0,0,0,0,0,0,130,416.76,420.03,1,1,And na that's freaking that's way
131,Group_01_131,Group_01,420.96,423.39,0,0,0,0,0,0,0,0,0,0,0,0,0,0,0,0,0,0,0,131,420.96,423.39,1,2,That's a hundred
132,Group_01_132,Group_01,423.87,430.47,0,1,0,0,0,0,0,0,1,0,0,0,0,0,0,1,0,0,0,132,423.87,430.47,1,1,Yeah that feels pretty pretty similar to me and try switching it left hand right hand maybe
133,Group_01_133,Group_01,432.66,435.72,0,0,0,0,0,0,0,0,1,0,0,0,1,0,0,0,0,0,0,133,432.66,435.72,1,2,That does feel pretty similar give it a shot
134,Group_01_134,Group_01,440.4,442.53,0,0,0,0,0,0,0,0,1,0,0,0,0,0,0,0,0,0,0,134,440.4,442.53,1,3,Yeah I think its
135,Group_01_135,Group_01,442.68,448.16,0,0,0,0,0,0,0,0,1,0,0,0,0,0,0,0,0,0,0,135,442.68,448.16,1,3,It feels really similar and that's a hundred grams
136,Group_01_136,Group_01,443.66,454.47,0,0,0,0,1,0,0,0,1,0,0,0,1,1,0,0,0,0,0,136,443.66,454.47,1,1,Yeah that's a good first guess and we get two so do you think we should a consensus on that one and this is fifty
137,Group_01_137,Group_01,448.91,450.5,0,0,0,0,1,0,0,1,0,0,0,0,0,0,0,0,0,0,0,137,448.91,450.5,1,2,Let's do it yeah a hundred I think
138,Group_01_138,Group_01,455.37,459.27,0,0,0,0,0,0,0,0,0,0,0,0,0,0,0,0,0,0,0,138,455.37,459.27,1,2,Thirty twenty right ok yeah
139,Group_01_139,Group_01,455.37,457.5,0,0,0,0,1,0,0,0,0,0,0,0,0,0,0,0,0,0,0,139,455.37,457.5,1,1,Thirty twenty
140,Group_01_140,Group_01,460.26,464.28,1,0,0,0,0,0,0,0,0,0,0,0,0,0,0,0,0,0,0,140,460.26,464.28,1,1,Uh yeah so should we press the blue arrow
141,Group_01_141,Group_01,464.64,473.25,1,0,0,0,0,0,0,0,0,0,0,0,0,0,0,0,0,0,0,141,464.64,473.25,1,3,We're on this screen right now should we go onto the next one ok
142,Group_01_142,Group_01,467.91,473.25,0,0,0,0,1,0,0,0,0,0,0,0,0,0,0,0,0,0,0,142,467.91,473.25,1,1,The current weight of the last that was our first test ok
143,Group_01_143,Group_01,470.75,472.01,0,0,0,0,0,0,0,0,0,0,0,0,0,0,0,0,0,0,0,143,470.75,472.01,1,4,Oh yeah you can continue
144,Group_01_144,Group_01,473.37,479.88,1,0,0,0,0,0,0,0,0,0,0,0,0,0,0,0,0,0,0,144,473.37,479.88,1,3,Two attempts a hundred will it tell us if we get it right or wrong ok
145,Group_01_145,Group_01,473.45,479.88,0,0,0,0,0,0,0,0,0,0,0,0,0,0,0,0,0,0,0,145,473.45,479.88,1,1,Ok a hundred ok 
146,Group_01_146,Group_01,481.71,485.94,0,0,0,0,0,0,0,0,1,0,0,0,0,0,0,0,0,0,0,146,481.71,485.94,1,1,That was not quite correct ok
147,Group_01_147,Group_01,487.11,489.69,0,1,0,0,0,0,0,0,0,0,0,0,0,0,0,0,0,0,0,147,487.11,489.69,1,3,I think it's more if it's anything
148,Group_01_148,Group_01,488.16,489.69,0,1,0,0,1,0,0,0,0,0,0,0,0,0,0,0,0,0,0,148,488.16,489.69,1,2,I think you're thinking more
149,Group_01_149,Group_01,491.07,493.59,0,0,0,0,0,0,1,0,0,0,0,0,0,0,0,0,0,0,0,149,491.07,493.59,1,3,That's less right now
150,Group_01_150,Group_01,493.72,495.42,0,0,0,0,0,0,1,0,0,0,0,0,0,0,0,0,0,0,0,150,493.72,495.42,1,2,Is that less right now oh
151,Group_01_151,Group_01,495.72,498.01,0,0,0,0,0,0,0,0,0,0,0,0,0,0,0,0,0,0,0,151,495.72,498.01,1,1,Oh yeah that is where we were at
152,Group_01_152,Group_01,498.5,521.25,0,0,0,1,0,0,0,0,0,0,0,0,0,0,0,0,0,0,0,152,498.5,521.25,1,2,We were at this yet ok
153,Group_01_153,Group_01,500.16,502.83,0,0,0,0,0,0,0,1,0,0,0,0,0,0,0,0,0,0,0,153,500.16,502.83,1,3,No that's a hundred and ten
154,Group_01_154,Group_01,505.68,511.29,1,0,0,0,0,0,0,0,0,0,0,0,0,0,0,0,0,0,0,154,505.68,511.29,1,1,The thing that sucks is that now we are finding about like torque and different other
155,Group_01_155,Group_01,504.9,505.5,0,0,0,0,0,0,0,0,0,0,0,0,0,0,0,0,0,0,0,155,504.9,505.5,1,2,Ooh
156,Group_01_156,Group_01,511.32,514.47,1,0,0,0,0,0,0,0,0,0,0,0,0,0,0,0,0,0,0,156,511.32,514.47,1,1,Perceptions of uh
157,Group_01_157,Group_01,517.02,519.24,0,0,0,0,0,0,0,0,1,0,0,0,0,0,0,0,0,0,0,157,517.02,519.24,1,2,I still think the brown one is heavier than this
158,Group_01_158,Group_01,525.0,526.13,0,0,0,0,0,0,0,0,0,0,0,0,0,1,0,0,0,0,0,158,525.0,526.13,1,2,It's hard to balance them
159,Group_01_159,Group_01,526.33,527.58,0,0,0,0,0,0,0,0,0,0,0,0,0,0,0,0,0,0,0,159,526.33,527.58,1,3,Yeah
160,Group_01_160,Group_01,533.01,537.3,0,0,0,0,0,0,0,0,0,0,0,0,0,0,0,0,0,0,0,160,533.01,537.3,1,1,I wonder like I don't know what that one
161,Group_01_161,Group_01,538.17,541.44,0,0,0,0,0,0,0,0,0,0,0,0,0,1,0,0,0,0,0,161,538.17,541.44,1,1,God yeah balances is hard I mean
162,Group_01_162,Group_01,539.83,540.22,0,0,0,0,0,0,0,1,0,0,0,0,0,0,0,0,0,0,0,162,539.83,540.22,1,2,Yeah
163,Group_01_163,Group_01,541.74,545.94,0,0,0,0,0,0,0,0,0,0,0,0,0,0,0,0,0,0,0,163,541.74,545.94,1,1,So I think definitely it's either
164,Group_01_164,Group_01,546.21,554.52,0,1,0,0,0,1,0,0,0,0,0,0,0,0,0,0,0,0,0,164,546.21,554.52,1,1,This or this cause we can't even make these weights so it could be above them I know but like if we are thinking it's so close to a hundred
165,Group_01_165,Group_01,549.41,550.5,0,0,0,0,1,0,1,0,0,0,0,0,0,0,0,0,0,0,0,165,549.41,550.5,1,3,That could be part of it
166,Group_01_166,Group_01,555.57,559.58,0,0,0,0,0,1,0,0,0,0,0,0,0,0,0,0,0,0,0,166,555.57,559.58,1,1,Are probably errors within yeah within this
167,Group_01_167,Group_01,557.58,558.66,0,0,0,1,1,0,0,0,0,0,0,0,0,0,0,0,0,0,0,167,557.58,558.66,1,3,Twenty  
168,Group_01_168,Group_01,559.08,561.69,0,0,1,0,0,0,0,0,0,0,0,0,0,0,0,0,0,0,0,168,559.08,561.69,1,2,I just like tried to put all the cubes in my hand at once
169,Group_01_169,Group_01,562.08,563.41,0,0,0,0,0,0,0,0,1,0,0,0,0,0,0,0,0,0,0,169,562.08,563.41,1,2,No that doesn't do anything
170,Group_01_170,Group_01,563.42,565.26,0,0,0,0,0,0,0,0,0,0,0,0,1,0,0,0,0,0,0,170,563.42,565.26,1,1,So would you
171,Group_01_171,Group_01,565.59,574.71,0,1,0,0,0,1,0,0,0,0,0,0,0,0,0,0,0,0,0,171,565.59,574.71,1,2,I would say either a hundred twenty or a hundred thirty because I feel like it would be possible for it to be out of range of what we can measure but
172,Group_01_172,Group_01,574.92,576.9,0,0,0,0,0,0,0,1,0,0,0,0,0,0,0,0,0,0,0,172,574.92,576.9,1,1,Yeah
173,Group_01_173,Group_01,578.88,582.09,0,0,0,0,0,0,0,0,1,0,0,0,0,0,0,0,0,0,0,173,578.88,582.09,1,1,Yeah it's just weird
174,Group_01_174,Group_01,589.86,602.07,0,1,0,0,0,0,0,0,0,0,0,0,1,0,0,1,0,0,0,174,589.86,602.07,1,1,I don't know I guess I would I would vote one of these two but what do you guys think ok
175,Group_01_175,Group_01,598.5,600.5,0,0,0,0,0,0,0,1,0,0,0,0,0,0,0,0,0,0,0,175,598.5,600.5,1,2,Between the two I would say a hundred twenty
176,Group_01_176,Group_01,603.9,608.64,0,0,0,0,0,0,0,0,1,0,0,0,0,0,0,0,0,0,0,176,603.9,608.64,1,3,It feels close I just can't tell if like
177,Group_01_177,Group_01,609.0,612.75,0,0,0,1,1,0,0,0,0,0,0,0,0,0,0,0,0,0,0,177,609.0,612.75,1,2,So right now this is one-twenty
178,Group_01_178,Group_01,610.5,611.08,0,0,0,0,1,0,0,1,0,0,0,0,0,0,0,0,0,0,0,178,610.5,611.08,1,3,One twenty
179,Group_01_179,Group_01,618.81,623.4,0,0,0,0,0,0,0,0,0,0,0,0,0,1,0,1,0,0,0,179,618.81,623.4,1,1,Do you want to try one twenty then
180,Group_01_180,Group_01,623.43,628.02,0,0,0,0,0,1,0,0,0,0,0,0,0,0,0,1,0,0,0,180,623.43,628.02,1,2,Yeah it's either one twenty or one thirty for me so I think one twenty would be the best guess
181,Group_01_181,Group_01,630.57,641.28,1,0,0,0,1,0,0,0,0,0,0,0,0,0,0,0,0,0,0,181,630.57,641.28,1,1,Eighty grams wow yes cause margin of error interesting
182,Group_01_182,Group_01,632.23,638.08,0,0,0,1,0,0,0,0,0,0,0,0,0,1,0,0,0,0,0,182,632.23,638.08,1,3,What hey hey we were right about our margin of error of twenty we were just thinking in the wrong direction 
183,Group_01_183,Group_01,641.79,645.92,0,0,0,0,0,0,0,0,1,0,0,0,0,0,0,0,0,0,0,183,641.79,645.92,1,1,Yeah there's it's gotta be something to do with the verticality of this but yeah we failed
184,Group_01_184,Group_01,646.25,647.15,0,0,0,0,1,0,0,1,0,0,0,0,0,0,0,0,0,0,0,184,646.25,647.15,1,3,Yeah
185,Group_01_185,Group_01,650.41,652.35,0,0,0,0,0,0,0,0,0,0,0,0,0,0,0,0,0,0,0,185,650.41,652.35,1,4,Um ok so  
186,Group_01_186,Group_01,652.65,655.02,0,0,0,0,0,0,0,0,0,0,0,0,0,0,0,0,0,0,0,186,652.65,655.02,1,4,For the final part of the task
187,Group_01_187,Group_01,655.17,666.21,0,0,0,0,0,0,0,0,0,0,0,0,0,0,0,0,0,0,0,187,655.17,666.21,1,4,Read the scenario that will come up for the next part of the survey and estimate the weight of the next block and you will again have two attempts to estimate and explain your answer
188,Group_01_188,Group_01,666.24,669.0,0,0,0,0,0,0,0,0,0,0,0,0,0,0,0,0,0,0,0,188,666.24,669.0,1,4,And you can now continue the survey
189,Group_01_189,Group_01,677.16,679.14,1,0,0,0,0,0,0,0,0,0,0,0,0,0,0,0,0,0,0,189,677.16,679.14,1,1,They didn't send us the next block
